,sub_chapter,summarization
97,10.11,"Chapter 10.11: Pole-zero plot for a third-order IIR filter. Frequency response (magnitude and phase) for a third-order IIR filter. From or, determine the value of the frequency response at. Impulse response for a third-order IIR filter."
98,10.12,Chapter 10.12: Lab~#11 is devoted to IIR filters. Several different filters are demonstrated. Demo: Three-Domains IIR A movie that animates the relationship between the -plane and the unit circle where the frequency response lies. Demo: PeZ GUI A tutorial on how to use PeZ. Demo: PeZ Tutorial A demo that gives more examples of IIR filters. Demo: IIR Filtering
99,10.2,"Chapter 10.2: Input signal to recursive difference equation. Thus, we will consider computing the output from the difference equation in the order. Output signal from recursive difference equation of for the input of Fig.~※. EXAMPLE:  Impulse Response For the example of with and, the impulse response is } 0 & } This is the impulse response of the system in."
100,10.3,"Chapter 10.3: First-order IIR system showing one feedback coefficient and two feed-forward coefficients and in Direct Form I structure. Recall that the product of two -transform system functions corresponds to the cascade of two systems. First-order IIR system in Direct Form II structure. then the overall system has the same system function as the original system. so we get Thus, because they have the same system function, and are equivalent to the Direct Form I and, and to the Direct Form II and."
101,10.4,"Chapter 10.4: EXAMPLE:  Find Poles and Zeros % The -transform of the feedback filter is easily derived to be When we express in positive powers of we see that there is one pole at and a zero at. EXAMPLE:  Zero at % For the -transform of the feedback filter we can write as The system has one pole at, and if we take the limit of as, we get. Determine the system function of the following feedback filter: Show that has a pole at, as well as. If, the pole of the system function is inside the unit circle of the -plane. EXAMPLE:  Stability from Pole Location The system whose system function is has a zero at and a pole at. Therefore the system is stable."
102,10.5,"Chapter 10.5: This must always be the case for the frequency response of a discrete-time system. Remember that the frequency response is a complex-valued function of frequency. Frequency Response using MATLAB Frequency responses can be computed and plotted easily by many signal processing software packages. Frequency response (magnitude and phase) for a first-order feedback filter. In this example, we can look for a connection between the poles and zeros and the shape of the frequency response. In this case, we can evaluate the frequency response directly from the formula to get Three-Dimensional Plot of a System Function The relationship between and the pole-zero locations of can be illustrated by making a three-dimensional plot of and then cutting out the frequency response. In this section, we use the system function to illustrate the relationship between the system function and the frequency response. Frequency response (magnitude and phase) for a first-order feedback filter."
103,10.6,"Chapter 10.6: It also defines the impulse response. The filter coefficients play a central role. Following the procedures illustrated for the first-order case, we can also define the -transform system function directly from the filter coefficients as and we can also obtain the frequency response Since the system function is a ratio of polynomials, the poles and zeros of make up a small set of parameters that completely define the filter. The inverse -transform is developed in Section ※."
104,10.7,Chapter 10.7: This process is called the inverse -transform. Determine the inverse -transform of to get the output. SHORT TABLE OF -TRANSFORMS 1. A General Procedure for Inverse -Transformation Let be any rational -transform of degree in the denominator and in the numerator.
105,10.8,"Chapter 10.8: This complex exponential component is the sinusoidal steady-state component of the output. Illustration of transient and steady-state responses of an IIR system. (a) total output, (b) decaying transient component, (c) steady-state response. Illustration of an unstable IIR system. Pole is at."
106,10.9,"Chapter 10.9: From the quadratic formula, we get two poles at When, both poles are real; when, they are real and equal. The poles and zeros are The system function can be written in factored form as either of the two forms Since the numerator has no term, we have one zero at the origin. Pole-zero plot for system with. Impulse Response of a Second-Order IIR System We have derived the general -transform system function for the second-order filter and we have seen that the denominator polynomial has two roots that define the poles of the second-order filter. The poles and zeros of are plotted in Fig.~※. The poles are at and ; there are two zeros at. Impulse response for system with. Pole-zero plot for system with. Pole-zero plot for system with."
